{"capture_revision_id":"81e4985b-3169-49a4-b76c-8316a7145117","capture_session_id":"0f936474-e29d-415d-9691-b52faed6227b","complex_object_prompts":true,"coordinate_space_id":"893addc6-b4b6-4cb4-8da2-67c64765ffa5","loop_closure_prompts":true,"policy_version":"capture_strategy_v1","resolved_policy":{"completion_direction_coverage_fraction":0.95,"keyframe_policy_version":"auto_keyframe_v1","maximum_no_depth_frames":2,"maximum_retained_bytes":134217728,"maximum_retained_frames":6,"maximum_spatial_guidance_attempts":5,"maximum_weak_region_guidance_attempts":2,"minimum_keyframe_interval_s":12,"minimum_keyframe_rotation_rad":1.0471975511965976,"minimum_keyframe_translation_m":0.75,"spatial_guidance_activation_coverage_fraction":0.55},"review_expectation":"standard","schema":"htdt.capture.strategy","schema_version":"1.0.0","selected_at":"2026-10-01T01:00:31Z","source":"operator_selected","strategy_id":"standard"}